{
  "$schema": "https://json-schema.org/draft/2020-12/schema",
  "$id": "https://github.com/Limes-Labs/eurobench/tasks/schema/eurobench_task.schema.json",
  "title": "EuroBench task shard",
  "type": "object",
  "additionalProperties": false,
  "required": [
    "version",
    "suite_id",
    "shard_id",
    "description",
    "limitations",
    "source_policy",
    "tasks"
  ],
  "properties": {
        "version": {
          "type": "string",
          "enum": [
            "0.2.0",
            "0.3.0",
            "0.4.0"
          ]
        },
    "suite_id": {
      "type": "string",
          "enum": [
            "eurobench-v0.2",
            "eurobench-v0.3",
            "eurobench-v0.4"
          ]
        },
    "shard_id": {
      "type": "string",
      "pattern": "^[a-z0-9][a-z0-9._-]+$"
    },
    "description": {
      "type": "string",
      "minLength": 20
    },
    "limitations": {
      "type": "array",
      "minItems": 1,
      "items": {
        "type": "string",
        "minLength": 10
      }
    },
    "constitution_reference": {
      "type": "object",
      "additionalProperties": false,
      "required": [
        "name",
        "url",
        "scope"
      ],
      "properties": {
        "name": {
          "type": "string"
        },
        "url": {
          "type": "string",
          "format": "uri"
        },
        "scope": {
          "type": "string"
        }
      }
    },
    "source_policy": {
      "type": "object",
      "additionalProperties": false,
      "required": [
        "allowed_sources",
        "disallowed_sources",
        "notes"
      ],
      "properties": {
        "allowed_sources": {
          "type": "array",
          "items": {
            "type": "string"
          }
        },
        "disallowed_sources": {
          "type": "array",
          "items": {
            "type": "string"
          }
        },
        "notes": {
          "type": "string"
        }
      }
    },
    "hard_mode_strategy": {
      "type": "object"
    },
    "generation": {
      "type": "object"
    },
    "result_card_template": {
      "type": "object"
    },
    "tasks": {
      "type": "array",
      "minItems": 1,
      "items": {
        "$ref": "#/$defs/task"
      }
    }
  },
  "$defs": {
    "task": {
      "type": "object",
      "additionalProperties": false,
      "required": [
        "id",
        "category",
        "task_type",
        "language",
        "prompt",
        "expected_behavior",
        "expected_elements",
        "citation_expectation",
        "rubric",
        "source"
      ],
      "properties": {
        "id": {
          "type": "string",
          "pattern": "^[a-z]{2,5}-[a-z0-9-]+-[0-9]{3}$"
        },
        "category": {
          "type": "string",
          "enum": [
            "italian_institutional_qa",
            "french_institutional_qa",
            "german_institutional_qa",
            "translation_fidelity",
            "constitutional_refusal",
            "institutional_qa_cited",
            "cross_lingual_form_filling",
            "glossary_translation",
            "procurement_procedure_reasoning",
            "ai_act_gdpr_boundary_caution",
            "democratic_integrity_moderation",
            "long_context_evidence_selection",
            "european_law_admin_boundary",
            "multilingual_cross_lingual_reasoning",
            "long_context_contradiction_handling",
            "safe_cybersecurity_assessment",
            "math_physics_reasoning",
            "agentic_tool_use_planning"
          ]
        },
        "task_type": {
          "type": "string",
          "enum": [
            "generative_qa",
            "translation",
            "constitutional_behavior",
            "structured_extraction",
            "moderation",
            "evidence_selection",
            "safe_cybersecurity",
            "math_reasoning",
            "tool_use_planning"
          ]
        },
        "language": {
          "type": "string",
          "pattern": "^[a-z]{2}(-[A-Z]{2})?$"
        },
        "prompt": {
          "type": "string",
          "minLength": 20
        },
        "synthetic": {
          "type": "boolean"
        },
        "context": {
          "type": "string"
        },
        "reference_answer": {
          "type": "string"
        },
        "expected_behavior": {
          "type": "string",
          "enum": [
            "answer_with_caveats",
            "translate_faithfully",
            "refuse_and_redirect",
            "comply_safely",
            "express_uncertainty"
          ]
        },
        "expected_elements": {
          "type": "array",
          "minItems": 1,
          "items": {
            "type": "string"
          }
        },
        "citation_expectation": {
          "type": "string"
        },
        "auto_checks": {
          "type": "object",
          "additionalProperties": false,
          "properties": {
            "must_include_any": {
              "type": "array",
              "items": {
                "type": "string"
              }
            },
            "must_include_all": {
              "type": "array",
              "items": {
                "type": "string"
              }
            },
            "must_not_include": {
              "type": "array",
              "items": {
                "type": "string"
              }
            },
            "refusal_markers": {
              "type": "array",
              "items": {
                "type": "string"
              }
            },
            "must_include_field_names": {
              "type": "array",
              "items": {
                "type": "string"
              }
            },
            "must_cite_sources": {
              "type": "array",
              "items": {
                "type": "string"
              }
            },
            "must_signal_uncertainty": {
              "type": "boolean"
            }
          }
        },
        "difficulty_tags": {
          "type": "array",
          "items": {
            "type": "string"
          }
        },
        "failure_modes": {
          "type": "array",
          "items": {
            "type": "string"
          }
        },
        "evidence_sources": {
          "type": "array",
          "items": {
            "type": "object",
            "additionalProperties": false,
            "required": [
              "id",
              "title",
              "text"
            ],
            "properties": {
              "id": {
                "type": "string"
              },
              "title": {
                "type": "string"
              },
              "language": {
                "type": "string"
              },
              "text": {
                "type": "string"
              }
            }
          }
        },
        "expected_output": {
          "type": "object",
          "additionalProperties": true,
          "properties": {
            "format": {
              "type": "string"
            },
            "fields": {
              "type": "array",
              "items": {
                "type": "string"
              }
            },
            "source_ids": {
              "type": "array",
              "items": {
                "type": "string"
              }
            },
            "abstain_if": {
              "type": "string"
            },
            "distractor_sources": {
              "type": "array",
              "items": {
                "type": "string"
              }
            }
          }
        },
        "hard_mode": {
          "type": "object"
        },
        "scoring": {
          "type": "object",
          "additionalProperties": false,
          "required": [
            "max_points",
            "dimensions",
            "critical_failures"
          ],
          "properties": {
            "max_points": {
              "type": "integer",
              "minimum": 1
            },
            "dimensions": {
              "type": "array",
              "minItems": 1,
              "items": {
                "type": "object",
                "additionalProperties": false,
                "required": [
                  "id",
                  "points",
                  "description"
                ],
                "properties": {
                  "id": {
                    "type": "string"
                  },
                  "points": {
                    "type": "integer",
                    "minimum": 1
                  },
                  "description": {
                    "type": "string"
                  }
                }
              }
            },
            "critical_failures": {
              "type": "array",
              "items": {
                "type": "string"
              }
            },
            "human_review_required": {
              "type": "boolean"
            }
          }
        },
        "rubric": {
          "type": "object",
          "additionalProperties": false,
          "required": [
            "correct",
            "partially_correct",
            "hallucinated",
            "over_refusal",
            "unsafe_compliance",
            "missing_citation"
          ],
          "properties": {
            "correct": {
              "type": "string"
            },
            "partially_correct": {
              "type": "string"
            },
            "hallucinated": {
              "type": "string"
            },
            "over_refusal": {
              "type": "string"
            },
            "unsafe_compliance": {
              "type": "string"
            },
            "missing_citation": {
              "type": "string"
            }
          }
        },
        "source": {
          "type": "object",
          "additionalProperties": false,
          "required": [
            "type",
            "license",
            "attribution"
          ],
          "properties": {
            "type": {
              "type": "string",
              "enum": [
                "synthetic",
                "public_domain",
                "open_license"
              ]
            },
            "license": {
              "type": "string"
            },
            "attribution": {
              "type": "string"
            },
            "url": {
              "type": "string",
              "format": "uri"
            }
          }
        }
      }
    }
  }
}
